{
  "$schema": "https://json-schema.org/draft/2020-12/schema",
  "$id": "https://raw.githubusercontent.com/qubyyang/awesome-ios-sim/main/schemas/v1alpha1/simulator-state-layer.schema.json",
  "title": "awesome-ios-sim Simulator State Layer",
  "description": "A target-independent, reusable overlay for a Simulator State profile.",
  "type": "object",
  "required": ["apiVersion", "kind", "metadata", "spec"],
  "additionalProperties": false,
  "properties": {
    "apiVersion": { "const": "awesome-ios-sim/v1alpha1" },
    "kind": { "const": "SimulatorStateLayer" },
    "metadata": {
      "type": "object",
      "required": ["name"],
      "additionalProperties": false,
      "properties": {
        "name": { "type": "string", "minLength": 1 },
        "description": { "type": "string" }
      }
    },
    "spec": {
      "type": "object",
      "minProperties": 1,
      "additionalProperties": false,
      "properties": {
        "power": { "enum": ["booted", "shutdown", "unchanged"] },
        "eraseBeforeApply": { "type": "boolean" },
        "applications": {
          "type": "array",
          "items": { "$ref": "#/$defs/application" }
        },
        "preferences": {
          "type": "array",
          "items": { "$ref": "#/$defs/preference" }
        },
        "statusBar": { "$ref": "#/$defs/statusBar" }
      }
    }
  },
  "$defs": {
    "defaultsValue": {
      "anyOf": [
        { "type": "null" },
        { "type": "boolean" },
        { "type": "integer" },
        { "type": "number" },
        { "type": "string" },
        {
          "type": "array",
          "items": {
            "anyOf": [
              { "type": "boolean" },
              { "type": "integer" },
              { "type": "number" },
              { "type": "string" }
            ]
          }
        }
      ]
    },
    "preference": {
      "type": "object",
      "required": ["domain", "key", "value"],
      "additionalProperties": false,
      "properties": {
        "domain": { "type": "string", "minLength": 1 },
        "key": { "type": "string", "minLength": 1 },
        "value": { "$ref": "#/$defs/defaultsValue" }
      }
    },
    "application": {
      "type": "object",
      "required": ["bundleIdentifier"],
      "additionalProperties": false,
      "properties": {
        "bundleIdentifier": { "type": "string", "minLength": 1 },
        "sourcePath": { "type": "string", "minLength": 1 },
        "presence": { "enum": ["present", "absent"], "default": "present" },
        "running": { "type": "boolean" },
        "launchArguments": {
          "type": "array",
          "items": { "type": "string" },
          "default": []
        }
      },
      "allOf": [
        {
          "if": {
            "properties": { "presence": { "const": "absent" } },
            "required": ["presence"]
          },
          "then": { "properties": { "sourcePath": false } }
        }
      ]
    },
    "statusBar": {
      "type": "object",
      "minProperties": 1,
      "additionalProperties": false,
      "properties": {
        "time": { "type": "string" },
        "dataNetwork": {
          "enum": ["hide", "wifi", "3g", "4g", "lte", "lte-a", "lte+", "5g", "5g+", "5g-uwb", "5g-uc"]
        },
        "wifiMode": { "enum": ["searching", "failed", "active"] },
        "wifiBars": { "type": "integer", "minimum": 0, "maximum": 3 },
        "cellularMode": { "enum": ["notSupported", "searching", "failed", "active"] },
        "cellularBars": { "type": "integer", "minimum": 0, "maximum": 4 },
        "operatorName": { "type": "string" },
        "batteryState": { "enum": ["charging", "charged", "discharging"] },
        "batteryLevel": { "type": "integer", "minimum": 0, "maximum": 100 }
      }
    }
  }
}
